### ISSUE TITLE
No local LAN control.

### ISSUE THREAD

**Issue by rubentest** [ZtF/hass-samsung-soundbar-local#16]
After try to check if I can control Sound grouping for rear speakers, I found the next in the network:

That means all the requests are comming  from internet, so no LAN control.
This is the expected behavior?

Is possible to control without internet?

```
tcpdump -ni any dst host samsung-q990h
tcpdump: WARNING: any: That device doesn't support promiscuous mode
(Promiscuous mode not supported on the "any" device)
tcpdump: verbose output suppressed, use -v[v]... for full protocol decode
listening on any, link-type LINUX_SLL2 (Linux cooked v2), snapshot length 262144 bytes
22:05:21.905676 lan2  Out IP 34.160.212.185.443 > 192.168.1.126.43164: Flags [.], ack 2957485710, win 1042, options [nop,nop,TS val 477864179 ecr 4169515004], length 0
22:05:21.905700 eth0  Out IP 34.160.212.185.443 > 192.168.1.126.43164: Flags [.], ack 1, win 1042, options [nop,nop,TS val 477864179 ecr 4169515004], length 0
22:05:22.180706 lan2  Out IP 34.160.212.185.443 > 192.168.1.126.43164: Flags [P.], seq 0:115, ack 1, win 1042, options [nop,nop,TS val 477864454 ecr 4169515004], length 115
22:05:22.180736 eth0  Out IP 34.160.212.185.443 > 192.168.1.126.43164: Flags [P.], seq 0:115, ack 1, win 1042, options [nop,nop,TS val 477864454 ecr 4169515004], length 115
22:05:22.199648 lan2  Out IP 34.160.212.185.443 > 192.168.1.126.43164: Flags [.], ack 40, win 1042, options [nop,nop,TS val 477864473 ecr 4169515297], length 0
22:05:22.199661 eth0  Out IP 34.160.212.185.443 > 192.168.1.126.43164: Flags [.], ack 40, win 1042, options [nop,nop,TS val 477864473 ecr 4169515297], length 0
22:05:25.197674 br-lan Out ARP, Request who-has 192.168.1.126 tell 192.168.1.1, length 28
22:05:25.197724 lan2  Out ARP, Request who-has 192.168.1.126 tell 192.168.1.1, length 28
22:05:25.197745 eth0  Out ARP, Request who-has 192.168.1.126 tell 192.168.1.1, length 46
22:05:30.187583 br-lan Out IP 192.168.1.1 > 192.168.1.126: ICMP echo reply, id 489, seq 0, length 43
22:05:30.187655 lan2  Out IP 192.168.1.1 > 192.168.1.126: ICMP echo reply, id 489, seq 0, length 43
22:05:30.187701 eth0  Out IP 192.168.1.1 > 192.168.1.126: ICMP echo reply, id 489, seq 0, length 43
22:05:36.915832 lan2  Out IP 34.160.212.185.443 > 192.168.1.126.43164: Flags [.], ack 883, win 1039, options [nop,nop,TS val 477879189 ecr 4169530014], length 0
22:05:36.915859 eth0  Out IP 34.160.212.185.443 > 192.168.1.126.43164: Flags [.], ack 883, win 1039, options [nop,nop,TS val 477879189 ecr 4169530014], length 0
22:05:37.190494 lan2  Out IP 34.160.212.185.443 > 192.168.1.126.43164: Flags [P.], seq 115:193, ack 883, win 1039, options [nop,nop,TS val 477879464 ecr 4169530014], length 78
22:05:37.190524 eth0  Out IP 34.160.212.185.443 > 192.168.1.126.43164: Flags [P.], seq 115:193, ack 883, win 1039, options [nop,nop,TS val 477879464 ecr 4169530014], length 78
22:05:37.213902 lan2  Out IP 34.160.212.185.443 > 192.168.1.126.43164: Flags [.], ack 922, win 1039, options [nop,nop,TS val 477879487 ecr 4169530312], length 0
22:05:37.213932 eth0  Out IP 34.160.212.185.443 > 192.168.1.126.43164: Flags [.], ack 922, win 1039, options [nop,nop,TS val 477879487 ecr 4169530312], length 0
22:05:40.190491 br-lan Out IP 192.168.1.1 > 192.168.1.126: ICMP echo reply, id 489, seq 0, length 43
22:05:40.190524 lan2  Out IP 192.168.1.1 > 192.168.1.126: ICMP echo reply, id 489, seq 0, length 43
22:05:40.190537 eth0  Out IP 192.168.1.1 > 192.168.1.126: ICMP echo reply, id 489, seq 0, length 43
22:05:41.027747 lan2  Out IP 34.160.212.185.443 > 192.168.1.126.43164: Flags [.], ack 1295, win 1038, options [nop,nop,TS val 477883301 ecr 4169534126], length 0
22:05:41.027771 eth0  Out IP 34.160.212.185.443 > 192.168.1.126.43164: Flags [.], ack 1295, win 1038, options [nop,nop,TS val 477883301 ecr 4169534126], length 0
22:05:41.297531 lan2  Out IP 34.160.212.185.443 > 192.168.1.126.43164: Flags [P.], seq 193:271, ack 1295, win 1038, options [nop,nop,TS val 477883571 ecr 4169534126], length 78
22:05:41.297553 eth0  Out IP 34.160.212.185.443 > 192.168.1.126.43164: Flags [P.], seq 193:271, ack 1295, win 1038, options [nop,nop,TS val 477883571 ecr 4169534126], length 78
22:05:41.321761 lan2  Out IP 34.160.212.185.443 > 192.168.1.126.43164: Flags [.], ack 1334, win 1038, options [nop,nop,TS val 477883595 ecr 4169534415], length 0
22:05:41.321789 eth0  Out IP 34.160.212.185.443 > 192.168.1.126.43164: Flags [.], ack 1334, win 1038, options [nop,nop,TS val 477883595 ecr 4169534415], length 0
22:05:41.321812 lan2  Out IP 34.160.212.185.443 > 192.168.1.126.43164: Flags [.], ack 1717, win 1037, options [nop,nop,TS val 477883595 ecr 4169534416], length 0
22:05:41.321818 eth0  Out IP 34.160.212.185.443 > 192.168.1.126.43164: Flags [.], ack 1717, win 1037, options [nop,nop,TS val 477883595 ecr 4169534416], length 0
22:05:41.592517 lan2  Out IP 34.160.212.185.443 > 192.168.1.126.43164: Flags [P.], seq 271:349, ack 1717, win 1037, options [nop,nop,TS val 477883866 ecr 4169534416], length 78
22:05:41.592548 eth0  Out IP 34.160.212.185.443 > 192.168.1.126.43164: Flags [P.], seq 271:349, ack 1717, win 1037, options [nop,nop,TS val 477883866 ecr 4169534416], length 78

```
